post,subreddit
"New Line new iPhone QuestionIf I get a new line and a new iphone, do I have to put the new line on the new iphone to get the $750 cash back?  Or can I put my current sim in the new iPhone, and the new sim/line in an older phone?  ",tmobile
"T-Mobile Begins Limited Home Internet Pilot, Laying a Foundation for Home Broadband Disruption in Advance of Merger with Sprint",tmobile
"MLB, T-Mobile Extend Sponsorship Agreement; Free MLB.TV Available To Customers",tmobile
(Idaho) Highway 21 cell towers to remedy dead zone near Lucky Peak,tmobile
"The Coolpad Snap flip phone experienceGrabbed the phone just for fun. I actually wish it was on KaiOS like the Alcatel is (or better yet Kai OS 2.5 but that's wishful thinking...). I have no idea what this is on but the biggest issue I'm having is that I can't sync to my Google account to grab my contacts. Only two options, import .vcf or import from sim. Blah. (Nokia 3310 3g was able to import via Bluetooth but I can't seem to even do that.)

Otherwise, has WiFi calling, hd voice and hotspot stuff.

Not bad for what it is. Call quality sounds good, haven't been in a noisy area yet to test those conditions out.

\[Edit: Ooo. I got the contacts thing figured out. Bluetooth sharing, duh!\]

\[Edit 2: Trying to dial a number can be confusing. It's very laggy, you can start punching in numbers and not see anything. Then it goes to a screen that makes absolutely no sense. ""Dial Number / no contacts"" before it shifts to the Calling screen.\]

\[Edit 3: **Don't get this phone unless you really want an LTE B71 unit for calls and text only.** The OS is really NOT user friendly and lags way too much. There's a learning curve involved, not intuitive like with the Alcatel Go Flip which uses KaiOS 1.0. A non-tech savvy person who doesn't want to spend much and who doesn't need B71 might be happier with a smartphone like the Nokia 6.1 if you can catch it at the $180 price point on Amazon. (If you DO get it, soften the blow by getting the $25 gift card back through the T-Mobile Advantage program if your work/organization is on the list.)\]

&#x200B;

**TL/DR: Bad phone.**",tmobile
T-Mo increased coverage capacity by three times around T-Mobile Park in Seattle,tmobile
"leaving t mobile for a while but coming back soon, what do I need to do in order to avoid paying an Sim (re: activation) feeI will be quitting my plan with t-mobile soon and I will likely sign up with tmobile One within a year.  If I hold on to the t-mobile sim I am using currently, what else is needed so I don't have to pay a sim fee?",tmobile
Urgent help re $50 Costco BYOD promoSigned up for 5 new lines tonight at my local costco. One clerk working and he was slammed due to iPhone promo. 4 of the 5 lines are BYOD. I did not have BYOD handsets with me so clerk used boxes for floor models of other iphones to process order. I realized I did not get any paperwork on the $50/line BYOD promo and I don't think he processed anything special on his end. Am I screwed? How can I get this promo? I have to go back to the store tomorrow anyways as clerk used SIM cards from their sister store over the phone because his store was out of stock. I will pick those cards tomorrow. ,tmobile
"Samsung Pay questionIs Samsung Pay an acceptable form of payment  at a Tmobile retail store? For example, I would like to use Samsung Pay to pay the downpayment of a S10+ Via the JUMP program. Can it be done?
",tmobile
EEEEEEEEEEEEEEEEEEEEEEEEEE,tmobile
"Multiple Duplicate Texts Being SentStarting today my I've been getting duplicate messages from my wife and she's been getting them from me. I've also gotten a few from other T-Mobile users that I text as well. We're all on Android using Google Messages so I'm not sure if it's a T-Mobile issue or a Google Messages issue. I haven't gotten any updates to the Messages app recently and am on 4.1.067. I've tried clearing my cache but that doesn't seem to resolve the problem. I texted my dad who's on Verizon several times and it didn't happen to him at all. Has anyone else been experiencing this?

&#x200B;

Edit: Wife and I are on Pixel 2 XL",tmobile
Combes talks to FCC about challenges for a stand-alone Sprint,tmobile
Could I buy this to trade on an XR?,tmobile
"Activating AppleSIM on T-MobileDo I have to activate the SIM card with Apple, or can I call T-Mobile and have them change the ICCID to the AppleSim?",tmobile
Android P to Galaxy S8?Is there an ETA on when we'll receive Android P on the Galaxy S8/S8+? I've been patiently waiting for what feels like an eternity at this point. ,tmobile
Has anyone been invited for the home internet yet?Just wondering how quick they are sending out invitations. ,tmobile
"Tmobile's new VM message is horrible! You have to wait 10 seconds listening to a stupid message first.Really Tmobile?  I don't need to be told that my messages will be deleted EVERY time I go to VM.

Plus VM's I've said to delete now stay there.",tmobile
"What happens if I buy a phone that doesnt support b71?I am on tmobile in nyc. If I get a phone with no b71 support (s10+ exynos), how will my everyday usage be affected? Thanks in advance.",tmobile
"Call forwarding international callsSorry for all these questions but I haven't been able to find answers on the web. I'm in the process of porting my landline number (#1234) over into my tmobile cell. Still want to use the house phone without the monthly bill. The cell line will belong to my mother who doesn't really use her cell phone. Once the porting is done, I was wondering if this was even possible to have incoming calls (domestic and international from mexico) to my cell (#1234) forward to a google voice number( linked to my house phone and obi200)

Or is it too much work, and should just port over the #1234 to tmobile and then port that over to google voice and use the house phone with that and forward the calls to my cell?

My bad is I confuse you as I'm confusing myself lol",tmobile
"Can I sign up for a prepaid account without the usage of the rebellion billing system?I want to sign up for a prepaid account because family is coming over, but I don’t want to use rebellion considering how terrible it is and I don’t have time to deal with calling customer support.

Is there a way to open a new prepaid account without using the rebellion billing system?",tmobile
"Note 9 One UI USJust got the DL for OTA One UI and update for my Note 9. Not sure how TMobile rolls it out but, you might want to check it.",tmobile
"What is a reasonable upgrade for unlimited data or higher per month data allowance for Simple Choice with 3 lines and 2GB data per line?Currently paying $95, taxes included, and would like to explore options for unlimited data or at least 10gb/line. Any suggestions?",tmobile
"Lte band 12 converterIs there a device that would be able to take in lte band 12, and output another band for an international phone that doesn't support band 12 to connect to?",tmobile
"how do spam/robo callers get contact numbers? do they get it via the wireless signal you text or call or something?1. how do spam/robo callers get contact numbers?
2. do they get it via the wireless signal you text or call or something?
3. do they target only certain areas?
4. do they call all numbers in the world?
5. how is it possible to have a safe numbers without fake calls with the spam/robo calls existing?
6. is tmobile selling the contact numbers of users?",tmobile
"Samsung Galaxy Buds v Icon Gear X 2018Hi all,

I'm on the fence about getting the new galaxy buds. I already have the icon gear x 2018 and was wondering if its worth an upgrade?",tmobile
"Is there a temporary hot spot data plan for travel? (no throttling)As the title says, I am going to be in Georgia for a couple weeks next month. I am currently under the military 1 plan with unlimited data. When I use my hot spot and connect my laptop the connection is not fast at all. (3G). I am wondering if there is a way to get a temporary plan that allows for 4g lte? Looking to play online games a little and streaming (netflix, youtube).",tmobile
"No signal, calls dropping?What's up with T-mobile? I bought a phone through them a galaxy S10 and I literally have no fucking service when I need my phone 70% of the time. 
I've gone to them and all they had me do was reset the phone. Seriously stupid to pay so much to get shitty service. I tried to make a phone call earlier an important one and I wasnt able to even make it walking around for a while to try to get some type of signal. Not sure if they even got the spam calls. All it said was stuck on calling. 

Even posting this was a bitch...",tmobile
"Anybody losing cell reception indoor? - Using Galaxy S10Hey everyone, so 3 days ago I started to lose cell service at my workplace in Culver City but only inside of the building. I can't make/receive any texts/calls except only when I step outside. 

Before then, I was getting perfect reception. For some reason I got cut off but not with my colleague who has T-mobile as well and they still continue to get reception indoors. They own an iphone but I don't know if that's the case or not.

I've tried restarting the phone and checking the SIM card for damages or anything, yet nothing seems out of the ordinary and the top of the screen says ""searching""...

Is it my phone's problem? I'm using the new S10 I bought since March 8th and it was working perfectly until just 3 days ago. 

I don't mind not getting LTE or anything but I'm concern about losing the cell reception in general as people won't be able reach me if there's any emergency.

I apologize for the long post and thanks for taking the time to read this. Please let me know if there's anybody experiencing the same problem and any advise or suggestion would be greatly appreciated.


TLDR: Phone not receiving reception at workplace indoor only, seeking for solution. 

",tmobile
"Just signed up and missed iPhone XR Promotion - Help?I just signed up for a new 3 line account on 3/19 and bought an iPhone XR when signing up. On 3/20, the promotion started where they are giving away an iPhone XR with a iPhone 6 trade in. So far, I've had no luck on getting this promotion offered even though I met the terms - just 24 hours too soon.

&#x200B;

Anyone have any advice on getting the credit? Starting off $750 in the hole is not how I wanted to start off with T-Mobile. Thanks!",tmobile
iPhone SE nano sim to any flip phoneI want to go back to basics and rock with a flip phone for a while. Are there any T-Mobile flip phones or any others that I can use my iPhone nano sim in?,tmobile
"Considering an eSIM trial run of T-Mobile service in SLC. WCGW?I'm in Salt Lake City, and I've been on Sprint for probably 12 years. I've been pretty happy with the service until fairly recently, when I started noticing some pretty serious gaps in coverage in areas where it should be (and has been) great. I thought maybe my phone was the problem, so I recently upgraded to an iPhone XS, but I'm still getting the same crappy coverage. 

So I'm thinking of signing up for T-Mobile's ""tourist"" plan through the iOS T-Mobile eSIM app ($30 for 1000 minutes and 2GB) to take the service for a test drive while keeping my Sprint plan simultaneously active. 

My question is, would doing this jeopardize my ability to take advantage of any new customer deals I might enjoy when signing up for T-Mobile One? Are there any other unapparent concerns I need to consider before signing up? 

If it matters, I'll be switching over four lines if/when I make the switch.",tmobile
"Can't switch from Simply Prepaid $50/mo to Simply Prepaid $40/moAs the title says, I am on Simply Prepaid $50/mo with the 10gb internet. When I login to my prepaid account, the only options for plan changes it shows are:

&#x200B;

Simply Prepaid Plans

$45mo with 4gb

$50mo with 10gm (what I'm already on)

&#x200B;

T-Mo One Prepaid 

$70/mo

&#x200B;

Pay as you go

$3/mo

&#x200B;

&#x200B;

Why are the prepaid websites such junk with Tmobile and other operators...",tmobile
"Is iPhone 5s not compatible?I'm an AT&T customer trying to jump ship, eyeing T-Mobile's bare-bones PayGo ($3/mo) plan, but when I enter my IMEI number to the site, it says,

> Bummer! Your Apple iPhone 5S (A1533) is not compatible with the T-Mobile's Network. We recommend you upgrade to a new T-Mobile phone that will give you the best coverage and fastest speeds. We recommend you *Buy a New T-Mobile Phone*

Weird. Why would this be? For the record: I don't care about having perfect coverage, crystal clear calls, or smooth data…that's why I'm getting the $3/mo plan, because I barely use my phone number (only FreedomPop and WhatsApp via wifi). I don't know much about cellular bands or compatibility or anything, but Google searching brings results like [this](https://www.whistleout.com/CellPhones/Guides/Will-my-iPhone-5s-work-on-another-carrier#heading-2) which *say* the 5s **is** compatible.

So is it?? Or isn't it??? Is T-Mobile just tryna get me to buy a new phone, or can I use my old phone or what?

Thanks

EDIT: LOL WHO DOWNVOTES THIS SHIT what did i do wronggggg",tmobile
"LG G8 PreordersIt's been over a month since TMobile announced they would carry the G8, and I haven't seen any information on when it will be available.  Does anyone have any information on this?   How long is the typical lag between announce and sales on LG phones?

",tmobile
How compatible is an iPhone X from sprint with tmobile?,tmobile
Mint mobile user here. Improvement going to actual tmo account ?I know mint mobile uses tmo towers but I was curious if coverage and speeds generally increase when switching to an actual tmo account and not using mint mobile. Coming over from Sprint using an unlocked note 8. Thanks in advance.,tmobile
"Coming next week Tuesday, March 26th",tmobile
"Is ""New Customer"" determined by name on account or phone number?Cancelled T-mobile about 60 days ago, 2 lines.  Want to go back with a current promotion.  I know it says 90 days is the wait to be considered a new customer - is that determined by the phone number or customer name/social?

&#x200B;

If it's by phone number, can you just sign up for a few new lines with new numbers, then when my old phone numbers hits the 90 day mark, just port it over into those lines?",tmobile
"An idea regarding thwarting neighbor spoofingFor a good few months now I've been trying to think of ways carriers might be able to thwart some of this shit and then I remembered a little thing called ANI II

""What's ANI II?"" 

Basically it's some supplemental data alongside ANI (a quasi-authoritative caller ID passed between switches in the PSTN, primarily for billing purposes) that tells the network what type of phone the calling party is using. More specifically it's a 2 digit integer. 00 represents a POTS line, IIRC, 61, 62, and 63 represent cellular and PCS, there's some other numbers in their for jail phones and payphones. Unfortunately for now, ANI and ANI II data can only be seen if you have a toll free number. I've actually bought an 800 specifically to get that data, it's pretty cool

""That's pretty cool. But how the hell could knowing the type of phone help?""

Well, think about it really. Most people have cell phones moreso than fixed line POTS and VOIP these days, so it's not unreasonable to think most people will be receiving bullshit calls on their cell phones. This means that the spoofers (unless you've ported your number or something) will likely be spoofing a number that's assigned to a cellular exchange. This is where ANI II could come in. When you spoof a call from a VOIP line, which is by far the easiest way to do this shit, the ANI II ends up being 00, a landline. A cellular number, presenting with ANI II that's completely inconsistent with the kind of carrier the number's associated with. If the FCC would permit it, this is an example of a basic heuristic that could possibly curb some of the neighbor spoofing shit",tmobile
"Esim Back To Physical SimSo I currently have the esim active on my Xr I am wondering what I have to do to deactivate the esim and go back to a physical sim? Thanks!

Thanks for the help everyone!",tmobile
"S10 Promo Rebate Submission Denied TwiceHey guys, I purchased a S10e from Costco and added a line to my account in order to take advantage of the promo to get $390 back in a rebate card. I made the purchase on the Saturday the 9th, submitted my photos on the promotions site on Monday the 11th and it was finally available to track on the 16th. The status page said it was denied because there was ""no transaction id on the receipt"" i submitted. So, i resubmitted the same day this time with the full receipt showing instead of just the top half. Then, today the 2nd submission was available to track, and it says it was denied for the exact same reason. I've been in contact with support via DMs on Twitter and they aren't much help. They keep asking for different receipts that Costco doesn't provide with purchases (I've previously done T-mobile promos at Costco). I was wondering who should i contact in order to get rebate submission help? Should i try Facebook messaging them or give them a call? Any help from someone who's had similar experiences with promos.",tmobile
"Visiting the US and considering going with T-Mobile.I'm going to the US later this year. I'm considering going with either T-Mobile or Cricket. And I'm leaning towards the former. I'm interested in the $50 unlimited plan.

Two questions. How fast is the ""3G speed"" when tethering? And do you get prioritized at 50GB or way before that?

Thanks in advance!",tmobile
"I am here to give a shoutout to the @tmobilehelp for their supportHad a problem with something on my account, call 2 times the customer support and went to 2 stores and couldn't help me (basically they left me in a limbo)

After DM them, they resolve my issue and even gave me account credit for the amount of the offer i lost because it was a mistake on T-Mobile part.

Talk about service",tmobile
Tmobile digits/line link/ google voiceHello just recently switched to unlimited 55+ with parent and noticed that we're pay the same amount for both our cell phone lines as our one landline. Looked into getting digits as we would like access to the # when not home but couldn't find international rates (Mexico) as it is the only reason we keep the landline... I know we have free international calling on tm one but my parent is used to using our landline number...looked into linelink but don't like the monthly fee if were not able to access it from anywhere...and then there's Google voice which is essentially like linelink but with no monthly fee but also no free international calling...anyone here use these services and would they recommend?? Thanks,tmobile
What are my options?I recently added a line to qualify for the galaxy s10 promotion of $390 off. However I just genuinely dislike its operating system. What are my options? If I return it do I qualify for the iPhone promotions? Or am I just screwed...,tmobile
"Is there any way to get a second phone number on my phone **with** a name for outgoing calls?I have a small business that has it's own phone number, through Google Voice.

For incoming calls, it's awesome. 

For outgoing calls, the Caller ID on the receiving end just has my phone number and some stupid town name that isn't even where I am.

I understand that DIGITS somehow allows multiple phone numbers, but I've hear horror stories about phone numbers getting all screwed up in the process of porting and I absolutely can't afford for that to happen.

Any suggestions?

Are there any phones that can handle 2 sims and 2 different phone numbers?

Anything I'm not thinking of?

**UPDATE**

I called tmobile and got setup with another phone number for DIGITS that will show my business caller id, so by tomorrow, everything should be all set. This means I don't need to go the scary route and try to port my number away from google, and possibly break my entire business.",tmobile
"Moved desks at work and went from 3 bars to 0 barsI work in a fairly big office building on the third floor out of four. I just moved desks about 150 feet South to more centered in the building and lost all cell signal. It went from 3 bars to nothing.

A femtocell would be out of the question. I have a Pixel 3, which I was hoping would improve things with b71 compatibility, which is supposedly in town.

Is there anything I'm missing or can do to improve this? I don't want to go carrier shopping because I had to change desks.",tmobile
"Do you need a Costco membership card to get the Samsung deal?Thank you in advance guys, Please let me know the following information. 

1. Do you need a Costco membership card to get the Samsung deal?
2. Do I get a gift card with $390 or is it bill credit?
3. Does Costco sell the device for less then T-Mobile I head it's $50 less?
4. Does my plan change? Because I'm grandfathered in and don't want to change the plan (Paying around $200 for 10 lines with international calling) 
5. Can I pay off the device once i get the gift card?

&#x200B;",tmobile
S10+ Stock in NYCJust picked up now S10+ at 34th street & 6th Avenue store in Manhattan. If anyone is looking for stores in the city,tmobile
"Advanced Messaging and the OnePlus 6TApparently Tmobile rolled out Advanced Messaging to my OnePlus 6T on March 13th.  That's the day that I stopped receiving messages from several people.

Not sure who to blame here, but took several weeks to figure out and there's no guarantee that my incoming messages will not stop again (it's not like someone calls you everytime they send a text).  On the OnePlus 6T, there are no user configurable settings and the user cannot 'disable' or opt out of Advanced Messaging.

I'm using the Google Messages App which is not compatible with Tmobile Advanced Messages.  Tmobile detects that my phone was upgraded and starts sending texts from other Tmobile Advanced Messages users to the stock OnePlus Messagse app.  Since I'm using the Google Messages App, there are no notifications or any indication that I'm missing messages from certain people.  Outgoing messages are sent just fine.

I got incoming messages to start working again by changing the default messaging app to the stock OnePlus Messagse app and then back to the Google Messages App.  Don't know what will happen when the OS is updated next time.",tmobile
KickbackHas anyone been successful with adding kickback to a new line added to your account if you originally had kickback?,tmobile
"Motorola One AndroidCo-worker has the phone with T-Mobile.. it's the XT1941-3 .. no matter what setting the data is set in the phone setting, it keeps connecting then disconnecting from 4G LTE .. Motorola claims this is T-Mobile compatible, is that for all practical purposes, a total lie (marketing ploy)?",tmobile
The umbrellas are nicer that the last ones they gave away two years ago. Compact and sturdy.,tmobile
"New t mobile accountWife and I are thinking of switching from Verizon to T-Mobile. We’d both like unlimited data and iPhone XR or Xs. 

Any great deals going on or coming up that we should wait for? She has an S7 and I have a iPhone 7plus. ",tmobile
"9th voice lineHey everyone. I am considering adding a ninth voice line to my account for a family member who is trying to leave their local carrier. T force told me that adding a ninth voice line would result in all of my promotions (kickback, several buy one get one line free, free oneplus) being lost. They followed up by saying they’d be willing to manually add them back on. Does anyone have any experience with this and do they really follow through and does the system really let them add these promotions back on? Thanks!",tmobile
Rebellion?Has Rebellion finally been fixed? It seems the complaints here have slowed to a trickle.,tmobile
Esim on postpaid iphone xs ,tmobile
"Will 600mhz 5G be available on devices like the S10 when the switch is flipped?I understand that t-mobile's 5G rollout of the 600mhz spectrum is still being worked on, along with mmwave tech as well. When this rollout is completed, will devices that have access to band 71 (600mhz) have access to any sort of 5G as well? Without having to have an x50/55 modem?",tmobile
"Discount for Paperless/EbillingHey all, 

I tried googling and searching the subreddit for this but couldn't find anything. Maybe it's because it doesn't exist, but I thought I remembered a T-mobile rep telling me that there is a discount for paperless billing?   
I am on a business account if that matters. 

&#x200B;

I know that there is a discount for auto pay so maybe that's where my confusion is coming from. ",tmobile
"Is customer service going to be affected by the merge with Sprint?I left Sprint for AT&T years ago because a) my calls kept dropping and b) the (presumably) overseas customer service was garbage. I was so sick of their customer service that I was happy to pay $30 more per month for AT&T. Last year, however, I switched to T-Mobile after 9 years with AT&T while on deployment and found the whole experience very pleasant. Both customer service centers with both companies were amazing. I’m also enjoying the much more reasonable cell phone bill each month. T-Mobile’s customer service may not be the best in the world, but they’re lightyears ahead of what I experienced with Sprint. I’d like to know if anyone has any insight about if the merger is going to negatively affect T-Mobile’s customer service quality? Thanks!",tmobile
"Any catch with the Netflix on us?I'm currently with another carrier and thinking of switching. Any catch with the Netflix account? I have my own Netflix account now, is there any catch/restriction that I might not anticipate from adding a promo code or however T-Mobile does it to pay for the account going forward? Device restrictions, etc?",tmobile
