post,subreddit
"Has anyone experienced this?Yesterday I was checking our usage detail in the T-Mobile app. One line showed phone calls and texts at 3:45 AM to Bahrain, Italy and New Jersey. What’s even more strange is that they were the same phone even thought it showed three different countries. 

I started checking the other lines and five out of our six lines showed the same calls and texts to the same countries, same number at the same time. 

I immediately called customer support who were extremely useless. They transferred me to technical support who said I should be talking to customer support who I asked not to transfer me who said let me check your account and without warning transferred me back to technical support. I hung up, called back and asked for a supervisor. Was put on hold forever and a day for a regular representative to come back to the phone. 

Anyway, is it possible that my numbers have been cloned? Do I have any malware? They are all iPhone X Max s if that makes any difference.

Thank you. ",tmobile
"OnePlus 6t RCS on Google Messages?Has anybody been able to get RCS/Chat features to work on Google Messages? I received the update and have been able to get it work RCS on the stock messaging app but would rather use Google Messages. My ""team of experts"" did not know what RCS was so they were not able to help. 

&#x200B;

OnePlus 6t on OxygenOS 9.0.4",tmobile
"Switching back to TMo Family Plan - Any good deals?Have been on my work's plan the past couple years but am changing jobs. Going to switch back to my family plan, which is much cheaper than individual. Family has had Tmo for 10+ years. BYOD a pretty much brand new iPhone XS, is there anything else / deal I could ask for? Apple Watch?",tmobile
"T-Mobile asking for a deposit for new wireless service, even though I have great credit?Hey guys,

I'm trying to ditch AT&T because they are too expensive, and saw that T-Mobile is a pretty great deal. I have a family plan right now with 3 lines of unlimited data for $160 a month. T-Mobile is offering unlimited data with T-Mobile ONE, buy 2 lines get the 3rd line free. So 3 lines of unlimited data for $120 a month (with autopay).

I called up and said I was ready to make the switch. I told the super nice lady that I wanted to bring my own 3 devices, and just needed service and the SIM cards. She checked my IMEI numbers, said the phones were compatible, checked my numbers, and said they were portable, so she started taking down my information.

All was well until we got to the credit check, she said everything looks good, BUT I need to put down a line deposit for each line. $75 for the first line, $55 for the second line, and $25 for the third line. She said that I would get my full $155 deposit back after paying my bill on time for 12 months in a row. When I asked why the deposit was needed, she gave me a vague ""it happens sometimes with customers who have not so good credit"" answer. What doesn't make sense to me is that my credit is great. As of today, my score is 800 with Transunion, and 807 with Equifax.

I asked her if the credit report she was looking at had any helpful information, basically... ""what's wrong with my credit?"" She said she can't tell me because it won't share any information with her for security reasons. Don't get me wrong, $155 is not a lot of money, so it's not the end of the world. What turns me off is that one of the reasons I want to go to T-Mobile is because there are no contracts.

T-Mobile holding my $155 for one year kind of feels like... well, a contract? I asked her... ""what if it turns out I don't like the service? What if reception is bad at my house? Or at my job? What if I find a better deal somewhere else?"" She said I would simply lose the $155 if I left T-Mobile before the 12 months are up.

I don't understand it. I don't want to finance any devices, I'm not asking them for a $1,000 phone to go along with the service or anything, I just want service and 3 SIM cards. I literally called T-Mobile and said ""here, please take my money. I want to give you $120 a month, plus $75 for the SIM cards, plus I want to sign up for auto-pay, here is my debit card."" And... T-Mobile said ""sure, thanks, but first we need an extra $155 from you. Don't worry you'll get it back a year later."" So here I am now, looking at Sprint and other options. T-Mobile not taking my money lol.

My question is, has anyone else experienced this with T-Mobile when signing up for their service? Is there anything I can do or anyone I can talk to to circumvent the line deposits? It just doesn't make any sense. Any advice would be appreciated. Thanks!",tmobile
"Google voice not ringingI use Google voice on T-Mobile, and have for years. Fewer and fewer of my calls are getting through. As a temporary fix, I am forwarding my Google voice calls to Hangouts, but that seems a bit of a kludge. Aside from forwarding to Hangouts, I have not made any changes to my settings, and the switch to send all calls to voicemail is not checked. I have deleted and reinstalled the app. Discussion boards elsewhere say the move is to call T-Mobile, because T-Mobile has determined that Google voice forwarding is a form of spam, but their customer support is clueless when I have tried. I do not see this question previously answered here. Does anybody have any code words I can use with T-mo?",tmobile
"T-Mobile Tuesday Discussion for March 12, 2019Please use this thread to discuss this week's T-Mobile Tuesday gifts and offers. **If you participate in trading, you are trading at your own risk. It is your responsbility to ensure a safe trade. The moderators will not intervene in the event a trade goes south.**
",tmobile
"Those Interested in Tower Posts, Can We Agree To Start Sharing Them On /r/Cellmapper?Now that the mods here have banned talking about cell towers on cell phone provider's subreddit... I think /r/cellmapper might be a good place to move those discussions? That subreddit is all about cell towers and identifying carriers so it seems like a good fit. What do you think?

It's a shame we need to move these discussions to another subreddit since it seems most of the knowledgable users already frequent this sub. Really disappointed in the mods. ",tmobile
"PSA - Tmobile Chat via Twitter Will Confirm IMEI Usage for Insurance ClaimsMany of us have third-party insurance (e.g., through credit cards) for stolen or damaged phones.  The claims people usually want proof that the phone was used on the billed line - and Tmobile bills only identify the phone for Iphones and Tmobile branded phones (at least that's my assumption, as my Pixel does not show up on the bill.

Today I asked Tmobile by Twitter DM to confirm the IMEI of the phone used on my line.  The rep verified I was who I said I  was by sending a text to my phone, and then confirmed the IMEI that had been used on the number in question.  I will now make a PDF of that chat session and upload it to the insurance company.",tmobile
"iOS Solutions to Robocalls?Hi all, what are some solutions to robocalls on iOS? ",tmobile
George Paul for Business Insider: New T-Mobile will disrupt the cable broadband market,tmobile
"SM-N60U1 Note 9 PieThe update just rolled out as of 11MAR19 - 22:34 PST! 

Enjoy",tmobile
"Coverage in Socal and outing roadsAfter seven years T-Mobile still has zero coverage on sr38 ( Red Lands to Big Bear), sr18 (Irvine Lake to Mission Viejo) and sr74 (San Juan Capistrano to Lake Elsinore). Not to mention spotty coverage while traveling, even with 600 band. Are these spots ever going to get coverage? For the first time in years i'm considering going over to the dark side. Just a month ago I was stuck in traffic during a snow storm in CA-38 for 4 hours on the return trip with no service, moving a couple of feet every 30 minutes. Then on a recent trip to a friends house, I found out there is no service in Irvine close to 133 and portola highway. I bought a s9+ hoping for better coverage, if tmobile does not improve their coverage in these areas. I think that it would be time to switch. I understand not having coverage in areas away from highways and civilization. But, not having and not improving coverage in seven years in these trafficked routes is pushing me to switch. What are your thoughts?",tmobile
"Deal Alert: BOGO 30% off on prepaid cards at Target, stacks with 5% red card discount and no tax. Expires 3/12.",tmobile
"Galaxy S10 Backorder~~Does anyone know when T-mobile will have new stock of 10+? I pre-ordered mine (Prism White 128gb) on 2/27 and i'm on backorder. This is ridiculous.~~

&#x200B;

**Finally Got An Update!!** Order Being Processed.. Shipment for 3/26-3/28",tmobile
"Phone possibly hacked? I'm not sure how this is possibleSo yesterday I got a phone call from t-mobile customer care saying I had bought an iphone and whether I had approved the purchase or not. He asked for the six digit pin that was texted to me. I was suspicious since he didn't sound very professional so I did not give him the number and assumed it was a phishing scam spoofing tmobile's customer care number. The odd thing is he knew the last 4 digits of my social. A few hours later I lose network signal, no voice or data. I use wifi to log into my tmobile account online to see if there was anything suspicious. The website says there is no tmobile account registered with this number. So I use my google number to wifi call tmobile customer service.

&#x200B;

I spent two hours trying to communicate with an Indian lady half way round the world over a phone signal that sounds like an AM radio. I could barely understand her and she would repeat things in a slow quiet voice that constantly broke up from the bad signal, sounding utterly confused and unsure of herself each time. I tried to get a manager but she said the manager wouldn't have any more information than she already did on her computer.

&#x200B;

Allegedly someone called them earlier today, pretending to be me, asking for my account information and balance, and subsequently cancelling my voice line while leaving the other lines on the family plan untouched. I asked them how was it so easy for them to cancel my line? She said I had to personally call them to make that decision from my smartphone, the one that's been with me all day, for that to happen. I asked if it was possible they spoofed my number and called them? She said no the system shows my number so it was from my phone line and my smartphone. I asked if I could get my number back. She said it had been ported to wholesale. I asked her what that was and how could it be ported out so quickly? She never answered most of my questions and I could barely make out what she was saying half the time, mainly because she would say it so meekly and uncertainly there was no emphasis on the words. I FINALLY got her to understand I needed a new line to replace the one cancelled under my family plan and told her I was getting a new SIM card from the Tmobile store instead of having her ship it. I almost got nothing out of the exchange, and I wasn't asking for much. Just some basic information. At least the initial ten minutes waiting on hold was rather quick, with plenty of voiceovers touting the quick and smart customer service tmobile provides with their team of ""experts"".

&#x200B;

I still don't know how they were able to cancel my line so easily. Now I'm getting emails saying a new amex card has been sent to a different address and the chase app has been installed and pushing notifications on iOS (I don't own any Apple products). Oh lord what fun.",tmobile
"Tech Support ScamJust giving a heads up to others out there. I've gotten 6+ phone calls, 4 of those back to back after I rejected them because I didn't know the number and because I was working (It didn't show up as T-mobile, but it did show as one of their numbers after I googled it), but they continued to call. 

Anyways, the number 1-800-937-8997 calls and says They're from T-Mobile tech support they'd like to confirm that I had added 2 lines on new iPhones. They did have the right Name, which is worrisome, but after they put me on hold (after saying they need to talk to me right away lol) I hung up. They haven't called back since then. Hopefully it doesn't happen again. 

Apparently people were doing this as far back as 2014 spoofing the tech support number but it's been popping back up again.

Also a side note, I don't know about you guys, but I have been getting an INSANE amount of spam calls recently. Like 3+ per day some days. I don't know what's been going on, but it's ridiculous. ",tmobile
Issues dropping service in NYC?Visiting NYC today and I see to be getting bounced off the network every few minutes or so.  Anyone else having issues?  I am using esim on iPhone so curious if that’s it.,tmobile
"Port out and port back inI added a new line to my account on Friday to get the 390 off Galaxy S10, I am chatting with a T-Force Rep and I asked her if one of my numbers ports out will it mess up any of my promotions and she said no. My next question is how long do I need to wait or do I even need to wait to port that number back in on top of the new line?",tmobile
"OnePlus 6Ts sudden battery usageOver the last week i have noticed both my 6T and my wifes have begun to use battery much more than they did previously.  Neither of us have changed anythign of significance or added and apps. we could use the phone all day and still be at 80%.
by noon otday i was donw to 71%, by the end of the day i will be at <30.
Any ideas what may have changed?  
",tmobile
Any stores out there carry smart locks?,tmobile
"iPhone X no serviceI have done plenty of research and usualy this happens if a phone is black listed but I purchased the phone from tmobile my self on launch day and have been with tmobile almost 5 years but now the phone just will not get service..

&#x200B;

Called tmobile  about 3-4 times just get told to reset phone every way possible and still nothing works this will be day 2 of no service and this would happen the day after i pay my bill on time which is set to auto pay..

&#x200B;

anybody else have this issue and get it fixed?",tmobile
"Traveling to GermanyDoes tmo offer an add-on or plan to get consistent 4g LTE in Germany, or at the very least 3g? My wife and I are current one members using pixel 3 phones. Last time we went we added one plus to our package and were pretty disappointed with the coverage.",tmobile
I got a Prism Blue S10+ ordered 3/5 what you got?I feel like maybe if we just write a forum that says when we ordered them and the kind we can have our own system to know if we are getting passed on. So heres the kind and date I ordered mine still hasnt been sent how about yall?,tmobile
"Anyone else not have their S10 shipped?Tuesday coming up and still no phone, whats the point of preorder then?",tmobile
New Video Dialer in OnePlus 6t: how does it work?Tmobile pushed an update that adds a video dialer but how does it work? Would the other person also need to be on TMobile and have an Android phone? ,tmobile
"Anyone else still waiting for their galaxy s10+?Just wondering if anyone with the same expected ship date as mine 3/9-3/11 have gotten their cards charged, or gotten any tracking info? I ordered the prism white 128gb",tmobile
"New rules and guidelines for the T-Mobile SubredditHi folks!

&#x200B;

The mod team has decided to change things up a bit in terms of pinned posts and content rules. The new changes are as follows:

&#x200B;

* **Speed tests** are now only allowed on **Mondays**. There will be a pinned post for them once a week every Monday. Speed tests posted on any other day (unless in the dedicated post) will be removed. This is mostly in line with the existing rule, except now the speed test megathread will only be pinned on Monday.

&#x200B;

* The **T-Mobile Tuesdays** megathread will only be pinned for that Tuesday, and the rest of the week it will not be. If there are any special Tuesday events it may stay pinned a bit longer.

&#x200B;

* **New Rule**: ""Who's on this tower?"" posts and pictures are no longer allowed in the subreddit. They're getting a bit spammy. We do however encourage them on the discord server (linked below). **EDIT**: We will be going with a “Tower Fridays” weekly megathread. Look for more info later this week!

&#x200B;

* We will also begin to pin useful or relevant posts throughout the week. If a particular post becomes really popular or has information that many people would find relevant, we will pin it.

&#x200B;

I would also like to take the time to remind everyone our guidelines regarding politically charged content in the sub. We have no rules against political posts or comments, at all, as long as they are relevant to T-Mobile. We do not censor or remove political comments regardless of their content, unless they violate the rules. If you post a comment and it is directly insulting someone or is entirely rude or hateful, it will be removed. Please know that this is not censorship of one political party or another. We want a healthy and thriving community with polite debate, not name-calling and hateful rhetoric. If you see comments, political or not, that violate the rules, please report them. DO NOT report comments just because you disagree with them.

&#x200B;

Please let us know in the comments below if you have any other suggestions or comments about these changes. Thanks!

&#x200B;

P.S: Click [HERE](https://discord.gg/FFNqGvs) to join our Discord server, where we talk about all things T-Mobile and offer community support!",tmobile
"What's the difference between Device Protection Tier 5 & Protection 360 Tier 5?So my Galaxy S10+ costs $14 for regular tier 5 & my S10e is $15 for the 360 one.

Edit: I'm on Jump on Demand.",tmobile
"Visual Voicemail app not working. (OnePlus 6T Intl)Hey,

So I have a OnePlus 6T (posted about this on the OP sub also) and now the Voicemail tab under the default Phone app is gone! 

&#x200B;

Anyone else?",tmobile
"Tmobile's push for getting merger approval.Seems like a thread was best for all of tmobile's decisions to try and help get the merger approved, instead of cluttering up the board with each new one 

Not sure if it will pass but this could help some (possibly)

https://www.tmonews.com/2019/03/t-mobile-support-sprint-lifeline-assistant-program-indefinitely-merger-approved/",tmobile
"T-Mobile / Live Nation Reserved SeatsI came across some shows on Ticketmaster/Live Nation and I saw they have some seats set aside for T-Mobile customers. Looks like you can get a code here:

[https://t-mobilereservedseats.com/](https://t-mobilereservedseats.com/) 

Anyone willing to send me a code? I'd be eternally grateful!

&#x200B;",tmobile
"Upgrading from SC to Essentials - was I given the wrong information?I was messaging with a rep via app chat and she let me know that I can upgrade my existing SC 6GB plan w/ 5 lines to T-Mo Essentials w/ 5 lines for $120. The motivating factor was unlimited data (no interest in Netflix). 

I have EIPs on all 5 which amounts to about $160. She confirmed that the final monthly cost for the plan and EIP would be around $285. I obviously decided to make the change. 

And then, I decided to do more research. All the information online says that Essentials is $30/line for 4 lines which means $120...

Did they mess up? I really hope she didn’t mess up and quote me the wrong price...",tmobile
"SC UNL option questionI have an old SC 4/$100 plan with one line upgraded to UL $30 option and with the recent changes to the promos I have another option for the same price to change to UL with 10 gig hotspot instead of my 7 gig limit. Anyone know if there are any gotchas and why I shouldn’t switch to the 10?

The text difference mentions binge on in the 10 and not in the 7. I have binge on turned off. I don’t know if the fact they mention it means you can’t turn it off?  Anyone on the 10 gig plan SMH have binge on turned off?


https://i.postimg.cc/fLfz5mDf/D4323-F03-F961-4-DD5-A515-2-F043-F452595.jpg
",tmobile
"how does upgrading your phone workI currently have the iphone 8 plus and i want to trade it in for the 10, but it hasn’t been a year which is when i think you can upgrade, but i also read when half of it is paid off. when you trade it in and still haven’t paid off the old phone do you have to pay for both of the phones? i’m just confused. ",tmobile
"Just landed in Italy, no data/textsI have the Simple Choice plan which should allow texting in Italy.

We have a Iphone 7 plus and Huawei Honor 8. Both phones are up to date and have data roaming enabled. I've tried restarting both, turning airplane mode on and off, dialing #766#, and trying +1 and 001 in front of phone numbers. The Huawei can receive some texts but is unable to send any and the iphone is unable to send/receive texts or get data. 

Any helpful fixes?",tmobile
"T-Mobile’s “Get Out Of The Red” questions:How does that process work?
How long do I need to be in T-Mobile? 
How do they repay me the amount to pay off my Verizon account?
Work they go more than $650?
When they repay me, is it simple to use their payment to pay off Verizon or do I need to use my own money to pay off Verizon (say if they gave me a Visa prepaid card, can I use that to pay off my amount ?) ? ",tmobile
"SC Plan, need to add a 3rd lineGrandfathered SC (6gb shared line). just got a text from TMO saying we are being given unlimited data shortly. We've decided to add a 3rd line for a child for emergency use. Thinking of a cheap flip phone. What do you guys think is the best plan of action for this? We have been with TMO since 2015.


thanks",tmobile
"S10 PreOrder Cancelled due to potential fraud—lost promo offerSo I get a text today saying my 2 phone order was cancelled because CC declined.  Called bank said it was flagged, called Tmobile and they said order cancelled, will have to create a brand new order, losing my preorder Galaxy Bud promo. Called within 30min of text, spoke with reps/supervisor 1hr+

Has anyone else had this issue?  Phone fraud is pretty common and the way they only bill CC after the promo ends I would think others should have lost the promo and if they had any luck resolving.

UPDATE: TMobile offered to create new order and bill me in installments for the Galaxy Buds, How’s that for customer service /s",tmobile
"Corporate discount did not transfer when I changed plan from SC FM UTT + UNL 4 lines Promo to SC NA UTT + 10 GB each 4 linesI recently changed my plan from  the SC FM UTT + UNL 4 lines $150 a month plan to the Promo to  the SC NA UTT + 10 GB each 4 lines $120 a month plan and I just received my new bill and noticed that I am no longer receiving a corporate discount, can anyone who had the same original SC FM UTT + UNL 4 lines $150 and changed to the  SC NA UTT + 10 GB each 4 lines $120 recently confirm if they are still receiving the corportate discount thanks?  FYI when I called t-mobile the rep stated that the new plan was already receiving a discount and that they could not add the corporate discount on the new plan.",tmobile
"Sprint, T-Mobile merger (and 5G) a 'tremendous' win for rural America",tmobile
"If you use up the Assurant lost/damage 3 times, is there anything you can do after that?I think I know the answer, but figured I'd ask. I'm having really crappy luck with phones in the last 6 months. Does it reset after a certain amount of time? Or are you just SOL and have to see what you can do to buy another phone? 

Any options out there. Not the richest man in the world so I know I won't be able to buy the last phone again outright.",tmobile
"""Wireless Partners LLC recently added T-Mobile service to its New Hampshire-Vermont 4G LTE rural cellular network that spans New Hampshire’s North Country and Vermont’s Northeast Kingdom.""",tmobile
"Anyone else having trouble buying galaxy buds through Tmobile?I've been trying to buy the buds through Tmobile online, and keep getting an error. Are they not available through Tmobile yet? Or ard they sold out?",tmobile
"New my.t-mobile website formatHow do I toggle BingeOn with the new website menu? I can't seem to find the pink toggle button with the new interface, nor can I find the sponsored data use category.",tmobile
Is there a speed x bandwidth table like this for 5G NR?,tmobile
"Band 71 build vs band 12?I know they will have a lot more band 71 when it's vacated. In the places they have b71 now are you seeing a broader build when compared to b12? 

To me b71 seems to be on more towers in each area when compared to b12 but I don't know that for sure ",tmobile
Can I trade this in?,tmobile
"/r/TMobile Speed Test Monday - March 11, 2019Hi everyone! Welcome to the Speed Test Monday thread. This is a weekly thread where you post your speed test and see others. We ask that in your comment, you include your speed test along with phone type, date and time, location, and whether it's indoor/outdoor. Enjoy!
",tmobile
Possible to 3xCA 2/66/66?,tmobile
