post,subreddit
"SIM card - $25 ripoffEvery time I call T-Mobile they tell me how important I am to them. I'm an 8 year post-paid customer, never late with a payment, average bill of $100. TMobile, you  can keep your Mobile Tuesday promos - I could give a rip about your silly Taco Bell coupons. And I don't care about the ""dedicated"" support team assigned to my account. You can keep them both. Just don't take advantage of me when I call you because I need a $0.50 piece of plastic from you. It makes me resentful enough that I feel like it might be time to look at other carriers. ",tmobile
Interesting article on how Sprint may fail without the merger.,tmobile
Yeah.. about that,tmobile
"Name ID less effective lately?I've been getting a number of calls lately that are not being identified by Name ID. At this point, I'm thinking of dropping the service. Yeah it is cheap enough, but it is becoming worthless.

I let the calls go to voicemail. Per the tip on this subreddit, I don't hit reject when the call comes in because they can tell a live person is at the phone. However I have been getting voicemail from about half these calls and some are wanted. ",tmobile
"Message Count on Usage OverviewI know that the details portion doesn’t include the phone numbers for ingoing/outgoing iMessages, but does the total number reflected on the overview for Messages include them?",tmobile
"Smart pick devicesSuper quick question, does T-Mobile still do smart pick devices and if so what phones are offered?.",tmobile
"T-Mobile ONE Amplified w Apple WatchHello! I’m considering the move from ATT to T-Mobile. As a federal government employee, I believe I am eligible for the Amplified plan. I went through the checkout process and it appears it would be $70 a month (after autopay credit) for the ONE plus plan. Can someone confirm this includes Plus features and DIGITS? Can I use the free DIGITS account on my cellular Apple Watch?  Thanks in advance for any replies!",tmobile
Free Dunkin AND Taco Bell each week now!!,tmobile
"Connectivity issues on non-LTE/4GI recently switched to T-mobile from Google Fi.  I was already on the T-mobile network 99% of the time on Fi.  My wife and I brought our own Moto x4 devices and I signed up over the phone.  I activated both phones with T-Mobile SIMs and they seemed to work OK for a couple of hours once we had our numbers ported.  My wife's device is still working well.

&#x200B;

I started having problems where my phone would not work with wifi calling (I got a couple errors) and the phone would show service on 2G/3G networks but would not calls or send SMS messages.  I swapped SIM cards at the local T-Mobile store (no cost) but this did not fix the problems.  I then bought a Galaxy S10e hoping that this would fix it all.  The new S10e was activated in store with another new SIM and functioned fine on LTE and Wifi calling once home, but as soon as I hit a non-LTE area the device displays bars (and a signal app I have shows service) but gives me an error: not registered on network.  It also says that I am unable to send SMS.  I have tried factory resetting the phone, restarting, toggling airplane mode on and off, and resetting network settings with no success.

&#x200B;

I have called tech support 2x and both times they checked some network settings on their end, had my restart the phone, and had me reset network settings.  Both times I was ultimate able to make a call on 2G but the issues came back within minutes.

&#x200B;

I like T-Mobile, but if I cant make calls/send messages that doesn't really matter.  I am hoping SOMEONE out there can point me in the right direction, because tech support isn't of much use and I feel like I might be missing something here.

&#x200B;

[https://imgur.com/a/p1wTX0n](https://imgur.com/a/p1wTX0n)",tmobile
Protection 360 + AppleCare = phone screen repairI just realized I am under the Protection 360 plan for my phone and that it covers AppleCare as well. However it has been over 2 years since I had bought this phone but I want to get my screen replaced (which I could've done right away if I knew about my plan from the start). Am I still able to bring it into Apple to get the screen replaced for the cost of $29?,tmobile
"Galaxy S5I have Sprint Galaxy S5 laying around in excellent condition. Can I put Tmobile motherboard in there, is it gonna fit.",tmobile
"Why can't I send texts on my brand new Samsung Galaxy S7?I just took my new Samsung Galaxy S7 to the T-Mobile store to get everything from my iPhone 4 switched over to my new phone. The lady did that and put the SIM card into my Samsung, and that's about it.


I can't send text messages for some reason though, even though my Wifi is working fine. I get the message, ""No signal found for mobile networks.""


I feel kind of dumb, I'm a millenial so I'd consider myself pretty easily adaptable to technology, but I can't figure out how to fix this. Is there something simple I'm missing? I don't have Wifi calling as an option, it's a button on my settings but it's a light grey color and I can't tap on it to open it.


edit: I got my mom and dad's text messages from their phones, but there was a significant delay in the time they sent it versus when I received it.",tmobile
"T mobile coverage in long island, specifically the Hamptons.Hi I was wondering if the coverage is any good on long island, specifically Hamptons bay. I'm moving there and thinking of switching from Verizon. Thanks!",tmobile
"AT&T S10 on T-Mobile?So I hate to post this here but can't find a clear answer.  I have read that some people say it doesn't work and others say it does.  I know there was different versions and updates of the Galaxy S and Note lineup where Samsung updated their phones so that whenever a SIM card is inserted, the phone would download the correct software for that carrier. 

Ultimately I can trade my Pixel 3XL for an AT&t S10 plus and I want to know if it would work. Once I put my T-Mobile SIM card in, will T-Mobile carrier software download to the S10.  I know Verizon phones do this because I have an old s8 that was previously a Verizon phone that when I put my T-Mobile SIM card in it downloaded T-Mobile software. ",tmobile
"Can someone help me understand how domestic roaming works?So far, I haven't seen any roaming since switching to TMobile, but I have read of people in this sub who have ended up roaming in rural areas. From what I've read, roaming is limited to 200MB per month. Is this for all roaming or only with certain partners?

Just trying to get a feel for what I'd be dealing with if I took a trip to the boonies, although I might be pleasantly surprised as my z3 play has band 71 and the boonies near me (Central PA) are getting lit up.
",tmobile
"T-Mobile loses Ookla ""fastest network"" crown after 19 quartershttps://www.engadget.com/2019/04/03/atandt-has-the-fastest-wireless-network-in-the-us/

Looks like they lost it after Q1 2019 results:

>Millions of tests from real wireless customers across all wireless networks show the Un-carrier had the fastest 4G LTE upload and download speeds for the 19th quarter in a row, according to Speedtest Intelligence® data from Ookla®

https://www.t-mobile.com/news/fastest-lte-19-quarters",tmobile
"Band 71 live here in Nashville,TN",tmobile
"Note 8 One UISo, when are we gonna get android pie on our note 8's, I need answers not delaying.",tmobile
"#GetOutOftheRedI'm sure you guys here get tons of questions about this and im sorry in advance.

&#x200B;

I'm currently on Verizon and We have two galaxy note 9's with balances of $707 until it is paid off. Now i know that T-mobile will cover up to 650 dollars on each phone. 

&#x200B;

Now my question is, will i still be allowed to switch over even though my balance on the phones is over $650? And if I am allowed to switch over, will they just add the left over balance of the phones to my bill?

&#x200B;

I'm not very good with this kind of stuff and I appreciate any help I can get. Thank you :)",tmobile
"iPad 12.9"" Smart Keyboard Folio (3rd Gen) AvailabilityT-Mobile has the iPad 11"" Smart Keyboard Folio in-stock and available for awhile now.

Wondering when we'll start seeing the 12.9"" variant become available?",tmobile
"Return phone if on jump on demand?I currently have a iPhone XS that I’m just not happy with.  I’d like to just return it and buy a device outright myself. I’m on a jod plan with T-Mobile and apple care.  Can I just return the phone if it’s still in mint condition?  I’m not sure how that works or if I’m stuck with it until it’s paid off. 

Edit: I’ve had the device for a few months. ",tmobile
"10 years from nowSo now with the advanced devices’ prices keep climbing, what do you guys reckon 10 years from now, will the down payment be higher than ever?? I spoke with a rep recently from T-Force asking about the down payment for iPad Pro 12.9 and they want $529 down payment and I was like JESUS! That’s too much. But I can’t imagine in 10 years. What do you guys think? ",tmobile
"Question on Verizon Pixel 3XL esimNow that on the latest Android Q beta, they have finally got eSim correctly running, how would I go about getting a prepaid t-mobile card for the esim? I am thinking about switching to t-mobile in the future, but I want to make sure the service is comparable in my area first, and this seemed like an easy way to do it. TIA. ",tmobile
"T-Mo/Sprint Merger's chances now on the decline, according to analyst",tmobile
Saw this convo about eSIM as I was scrolling through Twitter. No plans to charge for eSIM?,tmobile
"Viacom signs content distribution deal with T-Mobilehttps://www.google.com/amp/s/mobile.reuters.com/article/amp/idUSKCN1RF1HJ

Next step of getting streaming TV off the ground. Viacom is a good start and has enough varied programming and that audience seems to be the target of all of T-Mobiles marketing. ",tmobile
"galaxy s10 stock phone app and visual voicemailanyone know if the galaxy s10 stock phone app has visual voicemail capability -- within the stock phone app that is?  not having to use the tmobile visual voicemail app.  

&#x200B;

I've seen videos where ATT s10's have  built in visual voicemail in the stock phone app.  if available on tmobile, would like to know how to enable it.",tmobile
"Verizon’s mmWave UWB 5G tested by Verizon user outside US Bank Stadium, Minnesotahttps://www.howardforums.com/showthread.php/1689300-Verizon-4G-LTE-Speed-Test-Results-POST-EM-HERE!/page1014

User is using the moto z3 with 5G motomod
Notice the 5G microcell on the light post

I cant wait to try tmobiles band 71/mmWave 5G",tmobile
"NV/UT/AZ Road TripHow is T-Mobile? I have an LG Stylo 4 and LG K30.

&#x200B;

I will be flying into McCarran International in Paradise, NV; taking I-15 to St. George to explore the parks; then 86A/89 to the Grand Canyon and Flagstaff; then I-17 to Phoenix; and finally heading back to LAS via 93.

&#x200B;

I see there is native and roaming? Who is the roaming partner AT&T or Choice?",tmobile
How is TMobile's coverage in the San Fernando Valley and also the rest of LA?How is TMobile's coverage in the San Fernando Valley and also the rest of the Los Angeles Area? Im thinking about switching to tmobile.,tmobile
Band 71 will be live in ocean view Hawaii 96737 by the end of April i was told by T-Force representative that awesome i get poor coverage now i have a Samsung S9 plus T-Mobile version,tmobile
"Survey always goes to primary lineIs there an option to get the survey sent out after customer service calls/chats to go to the line that is chatting/calling? I don't know why it seems like a smart idea to send the survey to another line that might have no idea what was discussed, etc.",tmobile
Got a text for S10e BOGO when you add a line,tmobile
"FCC ups number of daily rounds in Auction 102 from 3 to 5From https://auctiondata.fcc.gov/public/projects/auction102/reports/clock_announcements: 

> Beginning Thursday, April 4, 2019, and continuing each business day until further notice, the bidding schedule will increase to five rounds per day.  The schedule will be as follows: 
 
> Bidding Round 10:00 AM – 10:30 AM Eastern Time (ET) 

> Bidding Round 11:30 AM – 12:00 noon ET
 
> Bidding Round 1:30 PM – 2:00 PM ET
 
> Bidding Round 3:00 PM – 3:30 PM ET 

> Bidding Round 4:30 PM – 5:00 PM ET 
 
> Round results will be available within 10 minutes after the close of each round. 
 
> Bidding today (Wednesday, April 3) will follow the current three-round schedule.
 
> Bidders should have firm back-up arrangements (which may include calling the Auction Bidder Line) ready for immediate implementation in case they encounter any difficulties accessing the bidding system.
 
> Bidders are reminded to view announcements regularly for bidding schedule changes and other important information. ",tmobile
I gave in and upgraded from SC 6gb to unlimited.I’m getting 8 lines for $240 with autopay. How do I get this any cheaper? ,tmobile
How do I switch my line that's part of a family plan to ATT&T?I'm the 5th line on a Tmobile family plan. I want to switch to my fiancee's plan on AT&T. What would happen to the Tmobile account if I simply switch over? Will it incur any fees? Do I need the account holder to approve?,tmobile
"T-Mobile Employees/Managers - Any discount advice?UPDATE: Chatted with support online today and they applied a $25 credit to my account for my trouble. I’ll take it! 

Curious if any current or past employees have any advice on how to cut my phone bill when I head back to the store tomorrow. 

&#x200B;

Went in to T-Mobile today to take advantage of my JUMP upgrade. Tech was nice, offered me 25% (he said it was his employee discount) right out of the gate for accessories. 45 minutes go by, and, due to some kind of error with their system they can't process my upgrade without needlessly charging me extra for my phone. No problem - I'll try another store. 

EDIT: For context, the system wasn’t recognizing I’d paid off 50% of the cost of my phone and was trying to make me pay an additional $180 even though I only have 4 payments left. 

&#x200B;

I walk a couple blocks to the second T-Mobile store. Another 20-30 minutes go by, and these folks are facing the same account issue and can't process my upgrade. They offer me a 15% discount on accessories (no surprise there is some flexibility here in what the store is willing to offer). 

&#x200B;

Considering  I'll have made a minimum of 3 trips to T-Mobile by tomorrow, and wasted a good 2+ hours of time,  I'm wondering what is a reasonable discount I should ask for when it comes time for brass tacks. I know in the past I've been able to knock off set up fees and get accessory discounts here and there. Any advice on what's a realistic range/the most you've seen knocked off?",tmobile
"Part time availability ?Does part timer required to work 5 days ? Also, can you get fix day off like Every Monday and Wednesday off ?",tmobile
"Disable Forwarding to Voicemail for Roaming?I have a TMO line on a friend's account. In the past he called customer service to disable voicemail on the line. It would ring indefinitely and never be forwarded anywhere.

Today I checked it and it went to voicemail after ringing for a while. So I try the short code to disable conditional forwarding ""##004#"" and it doesn't work. The T-Mobile DOC says that it ""Cancel call forwarding to voicemail (prevents new voicemail messages)"". So why doesn't it?

Source: https://support.t-mobile.com/docs/DOC-4041

The reason I don't want voicemail is that when I am roaming internationally I still want the phone to ring. If conditional forwarding activates one is automatically charged a minute of voice roaming. In some cases roaming is $5.99 a minute so it's a big deal.

**Edit:** This is a real issue: ""If your phone is on when you get an incoming call, even if you don't answer it and it goes to voicemail, the call is charged one minute for the call coming in to the phone.""  
Source: https://support.t-mobile.com/docs/DOC-2182",tmobile
"Note 9 Wi-Fi calling bounces between cellular and Wi-Fi preferredEver since the update to 9.0, my Note 9 keeps notifying me of the continuous switch between cellular and wi-fi preferred and is driving me crazy.  My call keep dropping because of this.  I live in an area that doesn't have much of a network signal and I rely on wi-fi to make calls and send/receive texts.  I've contacted T-mo, had Samsung technicians test/reset the device...no luck.  I also see that other carriers are having similar issues as well.  When are they going to send a patch for this????  HELP!",tmobile
Switched phones and signal at work is weakerWife and I both switched from Galaxy S8 and Note 8 to iPhones xs this past weekend.  In terms of the signal strength it seems to be weaker or slower while at work.  Any suggestions or thoughts on how this can be improved?,tmobile
NIICEEEEEE,tmobile
"T-Mobile Chat is the way to goAfter spending close to 2 hours on the phone with multiple handovers that did not get me eSim activated, I'm sooooo happy that I came across this thread. Went direct to the chat app and I was up and running flawlessly with some humor in less than 5 minutes.

&#x200B;

Try it...succesx assured.",tmobile
"Swapped to TMO from carrier that didn't support hotspot - trying to get that working on my phoneHey guys, I just swapped to T-Mobile from Straight Talk, and brought my Galaxy S7 along with me. As this was a phone bought through ST, the hotspot/tethering feature was disabled in software. I'm on TMO One, which supports hotspot, though, so I was wondering what I should to do re-enable the setting. I'm familiar with ADB, so if that's necessary I can do that. I've tried multiple third-party hotspot apps, and so far none have worked.

&#x200B;

Thanks!

&#x200B;

**EDIT:** I flashed G930U firmware, and all is good! Got hotspot options and it works! Thanks for the advice, guys!",tmobile
"Upgrade cost questionI have an upgrade available for my phone. Online it will let me do $0 down, just the tax. Will that be the same if I go into the store as well?",tmobile
"Realistically, if the merger fails, why don't Sprint and T-Mobile do a RAN-sharing agreement?It would be similar to what Bell and Telus do in Canada and would effectively create a single T-Mobile/Sprint nationwide network without having to merge, but would benefit from each other's spectrum holdings and network investments.",tmobile
"3G faster than LTE?Hello, I have a Samsung Galaxy S7 purchased originally under Sprint but has been unlocked and now I am on T-Mobile. I noticed that my mobile data was being slow and I only see a 3G in the status bar whereas before under Sprint it showed LTE. I am in the same area, Washington DC, so I think reception should be fine. 

I tried testing network settings and speeds and this is what I got: https://imgur.com/a/9ghAaF0

My phone was set to GSM / UMTS and showing 3G, and I got 1.78 Mbps download. After I switched to Automatic network type, it showed LTE, but download speed went down to 0.11, though Upload speed was higher.

Any ideas? Under the GSM / UMTS setting (3G) I also saw under SIM CARD STATUS that Signal strength was -93 dBm and mobile network type was ""HSPA"". Under Automatic (LTE), strength went to -104 dBm and mobile network type was LTE.
",tmobile
"Now that 36 Month payments is gone, how much will the Galaxy Fold down payment going to be?",tmobile
"Activating eSIM with promosI was just curious if activating esim on my iPhone XR will screw up my promo. I took advantage of the iPhone on us where you traded in an eligible iPhone and got an iPhone XR free via Bill credits. I want to activate the esim but don't want to lose the bill credits. also any pointers on how to get it activated for postpaid would be greatly appreciated! I saw many people on here do it in different ways whether it was iMessage chat, Twitter, Facebook messenger etc.",tmobile
"why was I charged a downpyamnet?After an 11 month hiatius im back with tmobile under my own account and not my moms; i ended up purchasing the iphone Xs but was charged a $250 downpayment plus taxes and fees although I didnt ask to put money down. I called an spoke with an agent today over the phone they said thats the minimum down payment for well qualified customers....ok, but i was under the impression that well qualified customers get 0 down what gives? Was i jerked?",tmobile
"iPhone 7 plus issuesAnyone else having issues with their iPhone 7 or 7 plus? Phone calls are going out and coming in, but we can't hear each other. Speaker won't work nor will headphones. 

Phone was working perfectly yesterday and all of a sudden it won't work. Apparently there have been a few other people with the same issue. Texting works just fine. ",tmobile
"So, my S7E just got the March 1st security update. My N8 is still sitting at January. This is really quite displeasing.",tmobile
"Merger with conditionsI read all of the posts on here about the Sprint and T-Mobile merger and often think about this. I wanted to see what other people have to say about this. maybe I am wrong, but isn't the only reason that Verizon and AT&t are so good coverage wise is because they were forced to be? somewhere along the way whether it was when they bought spectrum or merged with somebody didn't the government tell them that they had to cover a certain percentage of the United States? if that is the case, why can't they do that with TMobile to make sure that they keep their promises and actually expand rural coverage. I actually think that it should be a condition of the merger to make TMobile build out in rural underserved markets. It may not be profitable for them, but it will create another carrier with vast coverage and few dead spots such as AT&t and Verizon. ",tmobile
"Signal Booster causes congestion?I requested a signal booster roughly two years ago for my apartment when I moved to Chicago as the coverage was no where near what I got back in ATL.  I get 1 bar of service on my bed while I get 3 bars outside my apartment. For some odd reason, even with the signal booster I was getting 1 bar of service all this week. The signal booster is displaying E7 instead of 4 which is what it always display. I did give the T-Mobile Expert a call and I got routed 3 times to different agents. At the end, Tech support said the booster was disabled due to congestion in the area. I asked him when the congestion would end and when the booster will be reenabled and he said I am already in an always congested area. He said I should return the device with the shipping label and get my $25 deposit back towards my bill. I barely even use 6-7 GB data a month. I really wish I had wifi calling on my international S9.. Now, I look like the bad guy using a booster and causing congestion for other people. Could someone shine some light and make me feel better honestly?",tmobile
"Have any of you switched from verizon?I've been on Verizon for about 10years but am looking to switch mainly from the high cost and data limitations. T-Mobile seems pretty awesome simply from the fact you get unthrottled data up to 50gb. I'm most worried about coverage though here in CA. 

Have any of you switched from Verizon to T-Mobile? How does it compare speed and coverage wise?",tmobile
Small cells are not drunk driver proof.,tmobile
300 trade in for iPhone XRIs the 300 trade in deal a good deal? My spouse is wanting an iPhone since he misses iOS. He currently has a one plus 6t. Would this be a good deal? ,tmobile
"Help for understanding options for dual sim to combine personal and work phone on TMo and ATT lines?I currently have an iPhone 7 on T-Mobile postpaid for my personal phone. 

I currently have a Samsung Galaxy S7 on AT&T for my work phone through my company.

I’m due for an upgrade on both. Upgrading the T-Mobile phone is on my dime, upgrading the AT&T phone is on my company. 

Goal: I despise carrying 2 phones and want to take advantage of dual SIM to combine both lines into one phone.

My understanding is that to use dual SIM with two different carriers, the phone MUST be unlocked and therefore paid off. I’d prefer to upgrade my AT&T phone to iPhone XR and run my T-Mobile in that as an ESIM. But the phone won’t be unlocked as my company is making payments on it and I see T-Mobile does not officially support postpaid ESIM yet. Second choice is to upgrade my personal iPhone to a T-Mobile iPhone XR which will run me about 20 a month, but sounds like I won’t be able to use the AT&T ESIM as that also won’t be unlocked until it’s paid off.

Is my only option to buy an iPhone XR unlocked outright, put my current T-Mobile SIM card in that, then have my AT&T SIM card transferred to ESIM and put that in? Or am I missing other possible options?

The cell phone administrator at my company does not even know what dual SIM is and I had to explain it to her when I asked about it, so I’m not expecting any help there. She pretty much said “we can’t do that” I’m sure just because of lack of understanding. The ESIM transfer seems pretty easy on AT&T and can be done online, so I’m hoping if I give her step by step instructions on how to order one then that would take care of it. Ultimately I just don’t want to spend hundreds of dollars on a new phone only to find out it was a waste because I can’t get dual SIM working... if I can’t do this I’m just gonna ride this iPhone 7 into the ground since it’s paid off. 

Thanks so much in advance for any input. ",tmobile
Telecom analyst says approval for Sprint/T-Mobile deal less likely,tmobile
